{"index":{"version":"0.5.12","fields":[{"name":"title","boost":10},{"name":"body","boost":1}],"ref":"url","documentStore":{"store":{"./":["introduct"],"chapter1/DRUPALINTRO.html":["1","ad","adipis","aliqua","aliquip","amet","anim","aut","chapter","cillum","commodo","consectetur","consequat","culpa","cupidatat","deserunt","dolor","drupal","dui","ea","eiusmod","elit","enim","ess","est","et","eu","ex","excepteur","exercit","fugiat","id","incididunt","introduct","ipsum","irur","labor","labori","laborum","lorem","magna","minim","mollit","nisi","non","nostrud","nulla","occaecat","officia","pariatur","proident","qui","reprehenderit","sed","sint","sit","sunt","tempor","ullamco","ut","velit","veniam","volupt"]},"length":2},"tokenStore":{"root":{"1":{"docs":{"chapter1/DRUPALINTRO.html":{"ref":"chapter1/DRUPALINTRO.html","tf":5.0013054830287205}}},"docs":{},"i":{"docs":{},"n":{"docs":{},"t":{"docs":{},"r":{"docs":{},"o":{"docs":{},"d":{"docs":{},"u":{"docs":{},"c":{"docs":{},"t":{"docs":{"./":{"ref":"./","tf":11},"chapter1/DRUPALINTRO.html":{"ref":"chapter1/DRUPALINTRO.html","tf":0.0013054830287206266}}}}}}}}},"c":{"docs":{},"i":{"docs":{},"d":{"docs":{},"i":{"docs":{},"d":{"docs":{},"u":{"docs":{},"n":{"docs":{},"t":{"docs":{"chapter1/DRUPALINTRO.html":{"ref":"chapter1/DRUPALINTRO.html","tf":0.015665796344647518}}}}}}}}}}},"d":{"docs":{"chapter1/DRUPALINTRO.html":{"ref":"chapter1/DRUPALINTRO.html","tf":0.013054830287206266}}},"p":{"docs":{},"s":{"docs":{},"u":{"docs":{},"m":{"docs":{"chapter1/DRUPALINTRO.html":{"ref":"chapter1/DRUPALINTRO.html","tf":0.005221932114882507}}}}}},"r":{"docs":{},"u":{"docs":{},"r":{"docs":{"chapter1/DRUPALINTRO.html":{"ref":"chapter1/DRUPALINTRO.html","tf":0.028720626631853787}}}}}},"a":{"docs":{},"d":{"docs":{"chapter1/DRUPALINTRO.html":{"ref":"chapter1/DRUPALINTRO.html","tf":0.02610966057441253}},"i":{"docs":{},"p":{"docs":{},"i":{"docs":{},"s":{"docs":{"chapter1/DRUPALINTRO.html":{"ref":"chapter1/DRUPALINTRO.html","tf":0.0026109660574412533}}}}}}},"l":{"docs":{},"i":{"docs":{},"q":{"docs":{},"u":{"docs":{},"a":{"docs":{"chapter1/DRUPALINTRO.html":{"ref":"chapter1/DRUPALINTRO.html","tf":0.007832898172323759}}},"i":{"docs":{},"p":{"docs":{"chapter1/DRUPALINTRO.html":{"ref":"chapter1/DRUPALINTRO.html","tf":0.010443864229765013}}}}}}}},"m":{"docs":{},"e":{"docs":{},"t":{"docs":{"chapter1/DRUPALINTRO.html":{"ref":"chapter1/DRUPALINTRO.html","tf":0.015665796344647518}}}}},"n":{"docs":{},"i":{"docs":{},"m":{"docs":{"chapter1/DRUPALINTRO.html":{"ref":"chapter1/DRUPALINTRO.html","tf":0.013054830287206266}}}}},"u":{"docs":{},"t":{"docs":{"chapter1/DRUPALINTRO.html":{"ref":"chapter1/DRUPALINTRO.html","tf":0.013054830287206266}}}}},"c":{"docs":{},"h":{"docs":{},"a":{"docs":{},"p":{"docs":{},"t":{"docs":{},"e":{"docs":{},"r":{"docs":{"chapter1/DRUPALINTRO.html":{"ref":"chapter1/DRUPALINTRO.html","tf":5.0013054830287205}}}}}}}},"i":{"docs":{},"l":{"docs":{},"l":{"docs":{},"u":{"docs":{},"m":{"docs":{"chapter1/DRUPALINTRO.html":{"ref":"chapter1/DRUPALINTRO.html","tf":0.031331592689295036}}}}}}},"o":{"docs":{},"m":{"docs":{},"m":{"docs":{},"o":{"docs":{},"d":{"docs":{},"o":{"docs":{"chapter1/DRUPALINTRO.html":{"ref":"chapter1/DRUPALINTRO.html","tf":0.013054830287206266}}}}}}},"n":{"docs":{},"s":{"docs":{},"e":{"docs":{},"c":{"docs":{},"t":{"docs":{},"e":{"docs":{},"t":{"docs":{},"u":{"docs":{},"r":{"docs":{"chapter1/DRUPALINTRO.html":{"ref":"chapter1/DRUPALINTRO.html","tf":0.02610966057441253}}}}}}}},"q":{"docs":{},"u":{"docs":{},"a":{"docs":{},"t":{"docs":{"chapter1/DRUPALINTRO.html":{"ref":"chapter1/DRUPALINTRO.html","tf":0.015665796344647518}}}}}}}}}},"u":{"docs":{},"l":{"docs":{},"p":{"docs":{},"a":{"docs":{"chapter1/DRUPALINTRO.html":{"ref":"chapter1/DRUPALINTRO.html","tf":0.013054830287206266}}}}},"p":{"docs":{},"i":{"docs":{},"d":{"docs":{},"a":{"docs":{},"t":{"docs":{},"a":{"docs":{},"t":{"docs":{"chapter1/DRUPALINTRO.html":{"ref":"chapter1/DRUPALINTRO.html","tf":0.007832898172323759}}}}}}}}}}},"d":{"docs":{},"e":{"docs":{},"s":{"docs":{},"e":{"docs":{},"r":{"docs":{},"u":{"docs":{},"n":{"docs":{},"t":{"docs":{"chapter1/DRUPALINTRO.html":{"ref":"chapter1/DRUPALINTRO.html","tf":0.02349869451697128}}}}}}}}},"o":{"docs":{},"l":{"docs":{},"o":{"docs":{},"r":{"docs":{"chapter1/DRUPALINTRO.html":{"ref":"chapter1/DRUPALINTRO.html","tf":0.06527415143603134}}}}}},"r":{"docs":{},"u":{"docs":{},"p":{"docs":{},"a":{"docs":{},"l":{"docs":{"chapter1/DRUPALINTRO.html":{"ref":"chapter1/DRUPALINTRO.html","tf":0.0013054830287206266}}}}}}},"u":{"docs":{},"i":{"docs":{"chapter1/DRUPALINTRO.html":{"ref":"chapter1/DRUPALINTRO.html","tf":0.015665796344647518}}}}},"e":{"docs":{},"a":{"docs":{"chapter1/DRUPALINTRO.html":{"ref":"chapter1/DRUPALINTRO.html","tf":0.018276762402088774}}},"i":{"docs":{},"u":{"docs":{},"s":{"docs":{},"m":{"docs":{},"o":{"docs":{},"d":{"docs":{"chapter1/DRUPALINTRO.html":{"ref":"chapter1/DRUPALINTRO.html","tf":0.028720626631853787}}}}}}}},"l":{"docs":{},"i":{"docs":{},"t":{"docs":{"chapter1/DRUPALINTRO.html":{"ref":"chapter1/DRUPALINTRO.html","tf":0.031331592689295036}}}}},"n":{"docs":{},"i":{"docs":{},"m":{"docs":{"chapter1/DRUPALINTRO.html":{"ref":"chapter1/DRUPALINTRO.html","tf":0.015665796344647518}}}}},"s":{"docs":{},"s":{"docs":{"chapter1/DRUPALINTRO.html":{"ref":"chapter1/DRUPALINTRO.html","tf":0.013054830287206266}}},"t":{"docs":{"chapter1/DRUPALINTRO.html":{"ref":"chapter1/DRUPALINTRO.html","tf":0.013054830287206266}}}},"t":{"docs":{"chapter1/DRUPALINTRO.html":{"ref":"chapter1/DRUPALINTRO.html","tf":0.007832898172323759}}},"u":{"docs":{"chapter1/DRUPALINTRO.html":{"ref":"chapter1/DRUPALINTRO.html","tf":0.007832898172323759}}},"x":{"docs":{"chapter1/DRUPALINTRO.html":{"ref":"chapter1/DRUPALINTRO.html","tf":0.015665796344647518}},"c":{"docs":{},"e":{"docs":{},"p":{"docs":{},"t":{"docs":{},"e":{"docs":{},"u":{"docs":{},"r":{"docs":{"chapter1/DRUPALINTRO.html":{"ref":"chapter1/DRUPALINTRO.html","tf":0.005221932114882507}}}}}}}}},"e":{"docs":{},"r":{"docs":{},"c":{"docs":{},"i":{"docs":{},"t":{"docs":{"chapter1/DRUPALINTRO.html":{"ref":"chapter1/DRUPALINTRO.html","tf":0.010443864229765013}}}}}}}}},"f":{"docs":{},"u":{"docs":{},"g":{"docs":{},"i":{"docs":{},"a":{"docs":{},"t":{"docs":{"chapter1/DRUPALINTRO.html":{"ref":"chapter1/DRUPALINTRO.html","tf":0.010443864229765013}}}}}}}},"l":{"docs":{},"a":{"docs":{},"b":{"docs":{},"o":{"docs":{},"r":{"docs":{"chapter1/DRUPALINTRO.html":{"ref":"chapter1/DRUPALINTRO.html","tf":0.013054830287206266}},"i":{"docs":{"chapter1/DRUPALINTRO.html":{"ref":"chapter1/DRUPALINTRO.html","tf":0.02349869451697128}}},"u":{"docs":{},"m":{"docs":{"chapter1/DRUPALINTRO.html":{"ref":"chapter1/DRUPALINTRO.html","tf":0.020887728459530026}}}}}}}},"o":{"docs":{},"r":{"docs":{},"e":{"docs":{},"m":{"docs":{"chapter1/DRUPALINTRO.html":{"ref":"chapter1/DRUPALINTRO.html","tf":0.005221932114882507}}}}}}},"m":{"docs":{},"a":{"docs":{},"g":{"docs":{},"n":{"docs":{},"a":{"docs":{"chapter1/DRUPALINTRO.html":{"ref":"chapter1/DRUPALINTRO.html","tf":0.0026109660574412533}}}}}},"i":{"docs":{},"n":{"docs":{},"i":{"docs":{},"m":{"docs":{"chapter1/DRUPALINTRO.html":{"ref":"chapter1/DRUPALINTRO.html","tf":0.013054830287206266}}}}}},"o":{"docs":{},"l":{"docs":{},"l":{"docs":{},"i":{"docs":{},"t":{"docs":{"chapter1/DRUPALINTRO.html":{"ref":"chapter1/DRUPALINTRO.html","tf":0.010443864229765013}}}}}}}},"n":{"docs":{},"i":{"docs":{},"s":{"docs":{},"i":{"docs":{"chapter1/DRUPALINTRO.html":{"ref":"chapter1/DRUPALINTRO.html","tf":0.020887728459530026}}}}},"o":{"docs":{},"n":{"docs":{"chapter1/DRUPALINTRO.html":{"ref":"chapter1/DRUPALINTRO.html","tf":0.010443864229765013}}},"s":{"docs":{},"t":{"docs":{},"r":{"docs":{},"u":{"docs":{},"d":{"docs":{"chapter1/DRUPALINTRO.html":{"ref":"chapter1/DRUPALINTRO.html","tf":0.010443864229765013}}}}}}}},"u":{"docs":{},"l":{"docs":{},"l":{"docs":{},"a":{"docs":{"chapter1/DRUPALINTRO.html":{"ref":"chapter1/DRUPALINTRO.html","tf":0.013054830287206266}}}}}}},"o":{"docs":{},"c":{"docs":{},"c":{"docs":{},"a":{"docs":{},"e":{"docs":{},"c":{"docs":{},"a":{"docs":{},"t":{"docs":{"chapter1/DRUPALINTRO.html":{"ref":"chapter1/DRUPALINTRO.html","tf":0.010443864229765013}}}}}}}}},"f":{"docs":{},"f":{"docs":{},"i":{"docs":{},"c":{"docs":{},"i":{"docs":{},"a":{"docs":{"chapter1/DRUPALINTRO.html":{"ref":"chapter1/DRUPALINTRO.html","tf":0.015665796344647518}}}}}}}}},"p":{"docs":{},"a":{"docs":{},"r":{"docs":{},"i":{"docs":{},"a":{"docs":{},"t":{"docs":{},"u":{"docs":{},"r":{"docs":{"chapter1/DRUPALINTRO.html":{"ref":"chapter1/DRUPALINTRO.html","tf":0.015665796344647518}}}}}}}}},"r":{"docs":{},"o":{"docs":{},"i":{"docs":{},"d":{"docs":{},"e":{"docs":{},"n":{"docs":{},"t":{"docs":{"chapter1/DRUPALINTRO.html":{"ref":"chapter1/DRUPALINTRO.html","tf":0.010443864229765013}}}}}}}}}},"q":{"docs":{},"u":{"docs":{},"i":{"docs":{"chapter1/DRUPALINTRO.html":{"ref":"chapter1/DRUPALINTRO.html","tf":0.0391644908616188}}}}},"r":{"docs":{},"e":{"docs":{},"p":{"docs":{},"r":{"docs":{},"e":{"docs":{},"h":{"docs":{},"e":{"docs":{},"n":{"docs":{},"d":{"docs":{},"e":{"docs":{},"r":{"docs":{},"i":{"docs":{},"t":{"docs":{"chapter1/DRUPALINTRO.html":{"ref":"chapter1/DRUPALINTRO.html","tf":0.018276762402088774}}}}}}}}}}}}}}},"s":{"docs":{},"e":{"docs":{},"d":{"docs":{"chapter1/DRUPALINTRO.html":{"ref":"chapter1/DRUPALINTRO.html","tf":0.018276762402088774}}}},"i":{"docs":{},"n":{"docs":{},"t":{"docs":{"chapter1/DRUPALINTRO.html":{"ref":"chapter1/DRUPALINTRO.html","tf":0.010443864229765013}}}},"t":{"docs":{"chapter1/DRUPALINTRO.html":{"ref":"chapter1/DRUPALINTRO.html","tf":0.018276762402088774}}}},"u":{"docs":{},"n":{"docs":{},"t":{"docs":{"chapter1/DRUPALINTRO.html":{"ref":"chapter1/DRUPALINTRO.html","tf":0.020887728459530026}}}}}},"t":{"docs":{},"e":{"docs":{},"m":{"docs":{},"p":{"docs":{},"o":{"docs":{},"r":{"docs":{"chapter1/DRUPALINTRO.html":{"ref":"chapter1/DRUPALINTRO.html","tf":0.015665796344647518}}}}}}}},"u":{"docs":{},"l":{"docs":{},"l":{"docs":{},"a":{"docs":{},"m":{"docs":{},"c":{"docs":{},"o":{"docs":{"chapter1/DRUPALINTRO.html":{"ref":"chapter1/DRUPALINTRO.html","tf":0.018276762402088774}}}}}}}},"t":{"docs":{"chapter1/DRUPALINTRO.html":{"ref":"chapter1/DRUPALINTRO.html","tf":0.04177545691906005}}}},"v":{"docs":{},"e":{"docs":{},"l":{"docs":{},"i":{"docs":{},"t":{"docs":{"chapter1/DRUPALINTRO.html":{"ref":"chapter1/DRUPALINTRO.html","tf":0.015665796344647518}}}}},"n":{"docs":{},"i":{"docs":{},"a":{"docs":{},"m":{"docs":{"chapter1/DRUPALINTRO.html":{"ref":"chapter1/DRUPALINTRO.html","tf":0.013054830287206266}}}}}}},"o":{"docs":{},"l":{"docs":{},"u":{"docs":{},"p":{"docs":{},"t":{"docs":{"chapter1/DRUPALINTRO.html":{"ref":"chapter1/DRUPALINTRO.html","tf":0.028720626631853787}}}}}}}}},"length":64},"corpusTokens":["1","ad","adipis","aliqua","aliquip","amet","anim","aut","chapter","cillum","commodo","consectetur","consequat","culpa","cupidatat","deserunt","dolor","drupal","dui","ea","eiusmod","elit","enim","ess","est","et","eu","ex","excepteur","exercit","fugiat","id","incididunt","introduct","ipsum","irur","labor","labori","laborum","lorem","magna","minim","mollit","nisi","non","nostrud","nulla","occaecat","officia","pariatur","proident","qui","reprehenderit","sed","sint","sit","sunt","tempor","ullamco","ut","velit","veniam","volupt"],"pipeline":["trimmer","stopWordFilter","stemmer"]},"store":{"./":{"url":"./","title":"Introduction","body":"Introduction\n"},"chapter1/DRUPALINTRO.html":{"url":"chapter1/DRUPALINTRO.html","title":"Chapter 1","body":"Chapter 1: Introduction to Drupal\nLorem ipsum Consequat qui labore ex in mollit irure consectetur laboris irure sunt Ut elit veniam ea ut aliqua enim ex officia elit laborum laborum deserunt cillum tempor velit esse dolor ea sit enim Duis consectetur dolor elit voluptate ut pariatur deserunt dolore minim in in eiusmod dolor nostrud velit dolore esse commodo laboris sint cillum consequat ullamco sed cillum aliquip anim commodo est voluptate minim ea in in Duis dolor Duis consectetur ad in laborum elit ullamco aute sed consequat est velit labore sint esse in cillum ad ut proident incididunt incididunt do incididunt ut irure cupidatat minim irure sit ad qui sit sunt cillum et sunt fugiat proident dolore irure elit quis enim consectetur nisi dolor voluptate voluptate anim anim laborum cillum in nulla aliqua dolor consectetur tempor ad dolor id cupidatat eu deserunt cillum elit sint dolor commodo nulla nostrud nisi aute sit culpa proident amet deserunt aute fugiat eiusmod ex laborum consequat in occaecat.\nLorem ipsum Pariatur quis deserunt dolor eiusmod quis dolor in magna dolore irure commodo id eiusmod in ad incididunt in reprehenderit qui consectetur esse do irure dolor dolore Excepteur Ut cillum voluptate enim esse ea officia irure nostrud quis sunt elit deserunt in ut amet in qui laborum est ut ullamco sunt ut ea fugiat eiusmod nisi consequat ex veniam dolore laboris dolor labore ad nulla sit laboris ullamco amet nulla ut exercitation culpa exercitation sint Ut mollit Ut eu laboris veniam sit elit ut in voluptate id dolore id sed amet quis eu enim ea voluptate deserunt cillum ex do consectetur pariatur occaecat quis cupidatat culpa sed officia id dolore non incididunt reprehenderit officia do nostrud reprehenderit in voluptate proident eiusmod aliqua velit laboris laboris sed in dolore cillum sunt irure culpa pariatur quis aliquip adipisicing est qui occaecat Duis anim dolore consectetur velit dolor reprehenderit exercitation tempor culpa laboris sunt velit ad reprehenderit ad Excepteur do voluptate nisi pariatur ad nisi deserunt nisi reprehenderit consectetur elit reprehenderit officia elit laborum ex minim veniam ad eiusmod do eiusmod est elit et mollit consequat aute labore ullamco voluptate amet voluptate cillum tempor minim anim eiusmod aliquip non eiusmod dolore aliquip tempor Ut irure nisi commodo ut aute elit cillum sunt eiusmod veniam enim consectetur do dolor in exercitation non occaecat nisi pariatur ea fugiat Ut in et ullamco sit deserunt labore amet qui in Duis qui mollit tempor officia non quis nulla incididunt laboris sed irure laborum sed ullamco Duis.\nLorem ipsum Consequat qui labore ex in mollit irure consectetur laboris irure sunt Ut elit veniam ea ut aliqua enim ex officia elit laborum laborum deserunt cillum tempor velit esse dolor ea sit enim Duis consectetur dolor elit voluptate ut pariatur deserunt dolore minim in in eiusmod dolor nostrud velit dolore esse commodo laboris sint cillum consequat ullamco sed cillum aliquip anim commodo est voluptate minim ea in in Duis dolor Duis consectetur ad in laborum elit ullamco aute sed consequat est velit labore sint esse in cillum ad ut proident incididunt incididunt do incididunt ut irure cupidatat minim irure sit ad qui sit sunt cillum et sunt fugiat proident dolore irure elit quis enim consectetur nisi dolor voluptate voluptate anim anim laborum cillum in nulla aliqua dolor consectetur tempor ad dolor id cupidatat eu deserunt cillum elit sint dolor commodo nulla nostrud nisi aute sit culpa proident amet deserunt aute fugiat eiusmod ex laborum consequat in occaecat.\nLorem ipsum Pariatur quis deserunt dolor eiusmod quis dolor in magna dolore irure commodo id eiusmod in ad incididunt in reprehenderit qui consectetur esse do irure dolor dolore Excepteur Ut cillum voluptate enim esse ea officia irure nostrud quis sunt elit deserunt in ut amet in qui laborum est ut ullamco sunt ut ea fugiat eiusmod nisi consequat ex veniam dolore laboris dolor labore ad nulla sit laboris ullamco amet nulla ut exercitation culpa exercitation sint Ut mollit Ut eu laboris veniam sit elit ut in voluptate id dolore id sed amet quis eu enim ea voluptate deserunt cillum ex do consectetur pariatur occaecat quis cupidatat culpa sed officia id dolore non incididunt reprehenderit officia do nostrud reprehenderit in voluptate proident eiusmod aliqua velit laboris laboris sed in dolore cillum sunt irure culpa pariatur quis aliquip adipisicing est qui occaecat Duis anim dolore consectetur velit dolor reprehenderit exercitation tempor culpa laboris sunt velit ad reprehenderit ad Excepteur do voluptate nisi pariatur ad nisi deserunt nisi reprehenderit consectetur elit reprehenderit officia elit laborum ex minim veniam ad eiusmod do eiusmod est elit et mollit consequat aute labore ullamco voluptate amet voluptate cillum tempor minim anim eiusmod aliquip non eiusmod dolore aliquip tempor Ut irure nisi commodo ut aute elit cillum sunt eiusmod veniam enim consectetur do dolor in exercitation non occaecat nisi pariatur ea fugiat Ut in et ullamco sit deserunt labore amet qui in Duis qui mollit tempor officia non quis nulla incididunt laboris sed irure laborum sed ullamco Duis.\n"}}}